<?xml version="1.0" encoding="utf-8"?>
<senderliste
    xmlns="http://www.mospace.de/hspiel"
    xmlns:xsi="http://www.w3.org/2001/XMLSchema-instance"
    xsi:schemaLocation="http://www.mospace.de/hspiel/ radiosendeplaetze.xsd">


  <!-- SR -->
    <senderfamilie
        id="sr"
        name="Saarländischer Rundfunk"
        url="http://www.sr-online.de/">
            <!-- SR1 -->
        <sender
            id="sr1"
            name="SR 1 Europawelle"
            longname="Saarländischer Rundfunk Europawelle"
            url="http://www.sr-online.de/sronline/sr1/uebersicht/index.html"
            programmurl="http://www.sr-online.de/sronline/sr1/programm/index.html"
            frequenzenurl="http://www.sr-online.de/sronline/sr1/programm/frequenzen/index.html">
            <livestream>
                <url>http://streaming01.sr-online.de/sr1_2.m3u</url>
                <typ>MP3</typ>
                <mplayertyp>m3u</mplayertyp>
                <psradioid>153</psradioid>
            </livestream>
       <!-- Radiotatort -->
            <sendung
                id="sr1_radiotatort"
                name="Radiotatort"
                programmurl="http://www.ard.de/home/radio/ARD_Radio_Tatort/94130/index.html">
                <kategorie>Krimi</kategorie>
                <sendetermin
                    tag="1"
                    zeit="20:00"
                    dauer="60"
                    intervall="1x im Monat"
                    wdhvon="nwradio_radiotatort_mi"/>
            </sendung>
        </sender>
        <!-- SR2 -->
        <sender
            id="sr2"
            name="SR 2 KulturRadio"
            longname="Saarländischer Rundfunk KulturRadio"
            url="http://www.sr-online.de/sronline/sr2/uebersicht/index.html"
            programmurl="http://www.sr-online.de/sronline/sr2/programmvorschau/index.html"
            frequenzenurl="http://www.sr-online.de/sronline/sr2/service/frequenzen/index.html">
            <livestream>
                <url>http://streaming01.sr-online.de/sr2_2.m3u</url>
                <typ>MP3</typ>
                <mplayertyp>m3u</mplayertyp>
                <psradioid>154</psradioid>
            </livestream>
      <!-- SR2 FeatureZeit -->
            <sendung
                id="sr2_featurezt"
                name="FeatureZeit"
                programmurl="http://www.sr-online.de/sronline/sr2/sendungen_a-z/featurezeit/index.html">
                <kategorie>Feature</kategorie>
                <sendetermin
                    tag="6"
                    zeit="09:05"
                    dauer="55"/>
            </sendung>
      <!-- SR2 HörspielZeit -->
            <sendung
                id="sr2_hspielzt"
                name="Hörspielzeit"
                programmurl="http://www.sr-online.de/sronline/sr2/sendungen_a-z/hoerspielzeit/index.html">
                <kategorie>Hörspiel allgemein</kategorie>
                <kategorie>Krimi</kategorie>
                <!-- <sendetermin tag="4" zeit="20:04" dauer="56" anmerkung="wenn nicht um 18:00"/> -->
                <!--<sendetermin tag="4" zeit="20:04" dauer="56" anmerkung="am 19.11. sonst um 18:00"/>-->
                <sendetermin
                    tag="7"
                    anmerkung="darin einmal im Monat Radiotatort"
                    zeit="17:04"/>
            </sendung>
      <!-- SR2 Fortsetzung folgt -->
            <sendung
                id="sr2_forts"
                name="Fortsetzung folgt..."
                programmurl="http://www.sr-online.de/sronline/sr2/sendungen_a-z/fortsetzung_folgt/index.html">
                <kategorie>Serie</kategorie>
                <sendetermin
                    tag="1"
                    zeit="14:05"
                    dauer="25"/>
                <sendetermin
                    tag="2"
                    zeit="14:05"
                    dauer="25"/>
                <sendetermin
                    tag="3"
                    zeit="14:05"
                    dauer="25"/>
                <sendetermin
                    tag="4"
                    zeit="14:05"
                    dauer="25"/>
                <sendetermin
                    tag="5"
                    zeit="14:05"
                    dauer="25"/>
            </sendung>
        </sender>
    </senderfamilie>

  <!-- Radio Bremen -->
    <!-- aktualisiert 2009-03-30 -->
    <senderfamilie
        id="rb"
        name="Radio Bremen"
        url="http://www.radiobremen.de/">
    <!-- Nordwestradio -->
        <sender
            id="nwradio"
            name="nordwest radio"
            longname="Radio Bremen nordwest radio"
            url="http://www.radiobremen.de/nordwestradio/"
            frequenzenurl="http://www.radiobremen.de/nordwestradio/info/frequenzen/"
            programmurl="http://www.radiobremen.de/nordwestradio/sendungen/hoerspiel/">
            <livestream>
                <url>http://dl-ondemand.radiobremen.de/nordwestradio.m3u</url>
                <typ>MP3</typ>
                <mplayertyp>m3u</mplayertyp>
                <psradioid>5556</psradioid>
            </livestream>
       <!-- Radiotatort -->
            <sendung
                id="nwradio_radiotatort"
                name="Radiotatort"
                programmurl="http://www.ard.de/home/radio/ARD_Radio_Tatort/94130/index.html">
                <kategorie>Krimi</kategorie>
                <sendetermin
                    tag="3"
                    zeit="19:05"
                    dauer="55"
                    intervall="1x im Monat"
                    id="nwradio_radiotatort_mi"/>
            </sendung>
       <!-- Hörspiel -->
            <sendung
                id="nwradio_hspiel"
                name="Hörspiel">
                <kategorie>Hörspiel allgemein</kategorie>
                <sendetermin
                    tag="5"
                    zeit="19:05"
                    dauer="55"
                    intervall="14-täglich"/>
            </sendung>
      <!-- Niederdeutsches Hörspiel -->
            <sendung
                id="nwradio_ndthspiel"
                name="Niederdeutsches Hörspiel"
                programmurl="http://www.radiobremen.de/nordwestradio/sendungen/niederdeutsches_hoerspiel/">
                <kategorie>Dialekt</kategorie>
                <sendetermin
                    tag="7"
                    zeit="17:05"
                    dauer="55"
                    intervall="14-täglich"
                    id="nwradio_ndthspiel_so"/>
                <sendetermin
                    tag="1"
                    zeit="21:05"
                    dauer="55"
                    intervall="14-täglich"
                    id="nwradio_ndthspiel_mo"
                    wdhvon="nwradio_ndthspiel_so"/>
            </sendung>
      <!-- Feature -->
            <sendung
                id="nwradio_feature"
                name="Feature"
                programmurl="http://www.radiobremen.de/nordwestradio/sendungen/feature/">
                <kategorie>Feature</kategorie>
                <sendetermin
                    tag="7"
                    zeit="09:05"
                    dauer="55"
                    intervall="14-täglich"
                    id="nwradio_feature_so"/>
                <sendetermin
                    tag="3"
                    zeit="19:05"
                    dauer="55"
                    intervall="14-täglich"
                    id="nwradio_feature_mi"
                    wdhvon="nwradio_feature_so"/>
            </sendung>
      <!-- Fundsachen -->
            <sendung
                id="nwradio_fundsachen"
                name="Fundsachen"
                programmurl="http://www.radiobremen.de/nordwestradio/sendungen/feature/">
                <kategorie>Literatur</kategorie>
                <sendetermin
                    tag="7"
                    zeit="09:05"
                    dauer="55"
                    intervall="14-täglich"
                    id="nwradio_fundsachen_so"/>
            </sendung>
      <!-- Lesebuch -->
            <sendung
                id="nwradio_lesebuch"
                name="Lesebuch"
                programmurl="http://www.radiobremen.de/nordwestradio/sendungen/lesebuch/">
                <kategorie>Literatur</kategorie>
                <sendetermin
                    tag="1"
                    zeit="18:30"
                    dauer="30"/>
                <sendetermin
                    tag="2"
                    zeit="18:30"
                    dauer="30"/>
                <sendetermin
                    tag="3"
                    zeit="18:30"
                    dauer="30"/>
                <sendetermin
                    tag="4"
                    zeit="18:30"
                    dauer="30"/>
                <sendetermin
                    tag="5"
                    zeit="18:30"
                    dauer="30"/>
            </sendung>
        </sender>
        <!-- Bremen Vier -->
        <sender
            id="rb4"
            name="Bremen 4"
            longname="Radio Bremen Vier"
            url="http://www.radiobremen.de/bremenvier/"
            frequenzenurl="http://www.radiobremen.de/bremenvier/ueber-uns/kontakt/"
            programmurl="http://www.radiobremen.de/bremenvier/programm/themen/hoerbuecher/">
            <livestream>
                <url>http://dl-ondemand.radiobremen.de/bremenvier.m3u</url>
                <typ>MP3</typ>
                <mplayertyp>m3u</mplayertyp>
                <psradioid>7004</psradioid>
            </livestream>
       <!-- Radiotatort -->
            <sendung
                id="rb4_radiotatort"
                name="Radiotatort"
                programmurl="http://www.ard.de/home/radio/ARD_Radio_Tatort/94130/index.html">
                <kategorie>Krimi</kategorie>
                <sendetermin
                    tag="3"
                    zeit="19:05"
                    dauer="55"
                    intervall="1x im Monat"